{
  "$schema": "https://json-schema.org/draft/2020-12/schema",
  "$id": "https://nodekit.dev/schemas/nodekit.publication-approval.v1.schema.json",
  "title": "NodeKit decisive externally attested publication approval",
  "type": "object",
  "additionalProperties": false,
  "required": [
    "schemaVersion", "candidateCommit", "nodekitSourceHash", "nodekitIdentity",
    "releaseCandidate", "approved", "approvedAt", "approvedBy", "scopes",
    "attestationPayload", "attestation"
  ],
  "properties": {
    "schemaVersion": { "const": "nodekit.publication-approval/v1" },
    "candidateCommit": { "$ref": "#/$defs/commit" },
    "nodekitSourceHash": { "$ref": "#/$defs/sha256" },
    "nodekitIdentity": { "$ref": "#/$defs/nodekitIdentity" },
    "releaseCandidate": { "$ref": "#/$defs/releaseCandidate" },
    "approved": { "const": true },
    "approvedAt": { "$ref": "#/$defs/timestamp" },
    "approvedBy": { "type": "string", "minLength": 1, "maxLength": 256 },
    "scopes": {
      "type": "array",
      "minItems": 2,
      "maxItems": 2,
      "uniqueItems": true,
      "items": { "enum": ["npm-publish", "convex-directory-submit"] }
    },
    "attestationPayload": { "$ref": "#/$defs/payload" },
    "attestation": { "$ref": "#/$defs/attestation" }
  },
  "$defs": {
    "commit": { "type": "string", "pattern": "^[a-f0-9]{40}$" },
    "sha256": { "type": "string", "pattern": "^[a-f0-9]{64}$" },
    "nodekitIdentity": { "type": "string", "pattern": "^[a-f0-9]{40}/[a-f0-9]{64}$" },
    "timestamp": { "type": "string", "pattern": "^\\d{4}-\\d{2}-\\d{2}T\\d{2}:\\d{2}:\\d{2}(?:\\.\\d+)?(?:Z|[+-]\\d{2}:\\d{2})$" },
    "canonicalTimestamp": { "type": "string", "pattern": "^\\d{4}-\\d{2}-\\d{2}T\\d{2}:\\d{2}:\\d{2}\\.\\d{3}Z$" },
    "evidencePath": { "type": "string", "minLength": 1, "pattern": "^(?!/)(?!\\./)(?!.*//)(?!.*\\/$)(?!.*(?:^|/)\\.\\.?(?:/|$))(?![A-Za-z]:)(?!.*\\u0000)[^\\\\]+$" },
    "releaseCandidate": {
      "type": "object",
      "additionalProperties": false,
      "required": ["nodekitCommit", "nodekitSourceHash", "nodekitTarballSha256", "packageName", "packageVersion"],
      "properties": {
        "nodekitCommit": { "$ref": "#/$defs/commit" },
        "nodekitSourceHash": { "$ref": "#/$defs/sha256" },
        "nodekitTarballSha256": { "$ref": "#/$defs/sha256" },
        "packageName": { "const": "@homenshum/nodekit" },
        "packageVersion": { "type": "string", "pattern": "^\\d+\\.\\d+\\.\\d+(?:-[0-9A-Za-z.-]+)?$" }
      }
    },
    "evidenceRef": {
      "type": "object",
      "additionalProperties": false,
      "required": ["path", "sha256"],
      "properties": {
        "path": { "$ref": "#/$defs/evidencePath" },
        "sha256": { "$ref": "#/$defs/sha256" }
      }
    },
    "payload": {
      "type": "object",
      "additionalProperties": false,
      "required": ["schemaVersion", "type", "candidateCommit", "nodekitSourceHash", "nodekitTarballSha256", "decision", "scopes", "submissionManifest"],
      "properties": {
        "schemaVersion": { "const": "nodekit.publication-approval-attestation-payload/v1" },
        "type": { "const": "publicationApproval" },
        "candidateCommit": { "$ref": "#/$defs/commit" },
        "nodekitSourceHash": { "$ref": "#/$defs/sha256" },
        "nodekitTarballSha256": { "$ref": "#/$defs/sha256" },
        "decision": { "const": "approved" },
        "scopes": {
          "type": "array",
          "minItems": 2,
          "maxItems": 2,
          "prefixItems": [
            { "const": "convex-directory-submit" },
            { "const": "npm-publish" }
          ],
          "items": false
        },
        "submissionManifest": { "$ref": "#/$defs/evidenceRef" }
      }
    },
    "attestation": {
      "type": "object",
      "additionalProperties": false,
      "required": ["schemaVersion", "algorithm", "keyId", "signedAt", "payloadType", "payloadSha256", "signatureEncoding", "signature"],
      "properties": {
        "schemaVersion": { "const": "nodekit.detached-attestation/v1" },
        "algorithm": { "const": "Ed25519" },
        "keyId": { "type": "string", "pattern": "^[A-Za-z0-9][A-Za-z0-9._:@-]{0,127}$" },
        "signedAt": { "$ref": "#/$defs/canonicalTimestamp" },
        "payloadType": { "const": "publicationApproval" },
        "payloadSha256": { "$ref": "#/$defs/sha256" },
        "signatureEncoding": { "const": "base64url" },
        "signature": { "type": "string", "pattern": "^[A-Za-z0-9_-]{86}$" }
      }
    }
  }
}
